{"$defs":{"hash":{"pattern":"^sha256:[0-9a-f]{64}$","type":"string"},"member":{"additionalProperties":false,"properties":{"assertion_locator":{"additionalProperties":false,"properties":{"assertion_index":{"minimum":1,"type":"integer"},"exact_text":{"minLength":1,"type":"string"},"span":{"additionalProperties":false,"properties":{"end":{"minimum":1,"type":"integer"},"start":{"minimum":0,"type":"integer"}},"required":["start","end"],"type":"object"}},"required":["assertion_index","exact_text","span"],"type":"object"},"complete_gap_set":{"items":{"type":"string"},"type":"array","uniqueItems":true},"oracle_face_id":{"type":"string"},"oracle_face_key":{"additionalProperties":false,"properties":{"scryfallOracleId":{"format":"uuid","type":"string"},"side":{"type":["string","null"]}},"required":["scryfallOracleId","side"],"type":"object"},"quarantine_status":{"enum":["clear","quarantined"]},"relation_readiness":{"enum":["not_required","ready","blocked"]},"semantic_source_hash":{"$ref":"#/$defs/hash"}},"required":["oracle_face_id","oracle_face_key","semantic_source_hash","assertion_locator","complete_gap_set","quarantine_status","relation_readiness"],"type":"object"},"state":{"enum":["candidate","ready","blocked"]}},"$id":"https://openmagic.example/schemas/readiness-v1.schema.json","$schema":"https://json-schema.org/draft/2020-12/schema","additionalProperties":false,"properties":{"evaluator":{"type":"object"},"final_lifecycle":{"$ref":"#/$defs/state"},"initial_lifecycle":{"const":"candidate"},"predicates":{"minItems":1,"type":"array"},"reason_codes":{"items":{"type":"string"},"type":"array"},"schema":{"const":"factory.readiness/v1"}},"required":["schema","initial_lifecycle","final_lifecycle","predicates","reason_codes","evaluator"],"type":"object"}
