{"evaluator":{"input_receipt_set_hash":"sha256:47208fbb6ea4826e63bf0a530a8ad95ad08a496356629b237023a2c1b2ce795c","symbol":"compiler/readiness.py:evaluate"},"final_lifecycle":"ready","initial_lifecycle":"candidate","predicates":[{"id":"schemas_valid","reason_code":null,"satisfied":true},{"id":"cross_artifact_valid","reason_code":null,"satisfied":true},{"id":"history_dag_valid","reason_code":null,"satisfied":true},{"id":"quarantine_relation_clear","reason_code":null,"satisfied":true},{"id":"receipts_valid","reason_code":null,"satisfied":true},{"id":"engine_proven","reason_code":null,"satisfied":true},{"id":"creation_gates_passed","reason_code":null,"satisfied":true}],"reason_codes":[],"schema":"factory.readiness/v1"}
