{"evaluator":{"all_predicates_required":true,"sole_ready_authority":"compiler/validate.py:evaluate_readiness"},"final_lifecycle":"candidate","initial_lifecycle":"candidate","predicates":[{"id":"premise_current","reason_code":null,"satisfied":true},{"id":"schemas_valid","reason_code":null,"satisfied":true},{"id":"evidence_complete","reason_code":null,"satisfied":true},{"id":"scope_conserved","reason_code":null,"satisfied":true},{"id":"graph_valid","reason_code":null,"satisfied":true},{"id":"history_unique","reason_code":null,"satisfied":true},{"id":"quarantine_relation_clear","reason_code":null,"satisfied":true},{"id":"skill_valid","reason_code":null,"satisfied":true},{"id":"engine_proven","reason_code":"E_ENGINE_BEHAVIOR_GATE_FAILED","satisfied":false},{"id":"creation_gates_passed","reason_code":"E_CREATION_GATE_FAILED","satisfied":false}],"reason_codes":["E_ENGINE_BEHAVIOR_GATE_FAILED","E_CREATION_GATE_FAILED"],"schema":"factory.readiness/v1"}
